,title,location,company,summary,salary,url
299,Home Care Nurse,Dubai,Medi team medical services,Maintain a safe and clean working environment in compliance with healthcare procedures and regulations.Assisting doctors with physical examinations and care…,"AED8,000 - AED9,000 a month",https://uae.indeed.com/company/Medi-team-medical-services/jobs/Home-Care-Nurse-616c27b29cb64aae?fccid=6160e5dfdd549606&vjs=3
300,PCR SWAB NURSE - DHA LICENSED,Dubai,First Response Healthcare LLC,"Should have worked in Dubai for minimum 2 years in healthcare.First Response Healthcare (FRH) is Dubai’s leading doctor-on-call service provider, proudly…",,https://uae.indeed.com/company/First-Response-Healthcare-LLC/jobs/Pcr-Swab-Nurse-c85fe516ce32f0ad?fccid=338ac8ec172730d9&vjs=3
302,Graduate Surveyor,Dubai,Cavendish Maxwell,"Value commercial property specifically within the hospitality, education and healthcare sectors.Firm understanding of the day-to-day operations of the…",,https://uae.indeed.com/rc/clk?jk=aefb95b5a096886d&fccid=3754f171edff53ef&vjs=3
304,"HAAD Homecare Nurses - up to AED 12,500 - Abu Dhabi",Abu Dhabi,CIMS Medica,"Minimum 2 Years of working experience.Must have HAAD License/Eligibility letter.Must have Bachelor’s Degree in Nursing.UP to 12,500 AED /month*.","AED12,500 a month","https://uae.indeed.com/company/Cims-Medica-FZC-LLC,/jobs/Haad-Homecare-Nurse-9d1917d40c18dbc2?fccid=7f51d8667c592f1e&vjs=3"
306,Logistics Manager,Abu Dhabi,Marc Ellis Consulting,Work directly with Healthcare entities and partners to develop the vaccine distribution master schedule and demand model.,,https://uae.indeed.com/rc/clk?jk=500472319f268d20&fccid=d25332eb688f9794&vjs=3
307,General Practitioner,Dubai,Valiant Clinic,Collaborate with healthcare professionals to plan or provide treatment.Coordinate and direct a team of nurses and other healthcare professionals.,,https://uae.indeed.com/company/Valiant-Clinic/jobs/General-Practitioner-415dcc3b0b69997d?fccid=739fc8c0bd3bdd16&vjs=3
308,Solution Architect,Abu Dhabi,Cerner Corporation,"Bachelor's degree in IT, HealthCare or related field, or equivalent relevant work experience.As a Solution Architect on the Support Services Organization…",,https://uae.indeed.com/rc/clk?jk=acc86a3b19554627&fccid=95fa2b94b684ec6b&vjs=3
309,Sales Manager - Dubai,Dubai,Caduceus Lane,"Healthcare, medical, or pharmaceutical industry orientation is a plus.Keep abreast of trends in commercial initiatives relevant to the healthcare and…",,https://uae.indeed.com/company/Caduceus-Lane/jobs/Sales-Manager-7a96dc8dfa678ccb?fccid=d49b22960c0d2a4f&vjs=3
310,UAE National Graduate Program,Dubai,Meraas Holding,"Meraas is a Dubai-based conglomerate that aims to enhance the emirate’s cityscape with a human-centric approach to developing assets in the real estate, tourism…",,https://uae.indeed.com/rc/clk?jk=c61428ae7393c9f9&fccid=a1d8d4e7b83780c8&vjs=3
311,Application Support Specialist – Billing & RCM,Dubai,InterSystems,"In healthcare, business, government, and other sectors where lives and livelihoods are at stake, InterSystems is the power behind what matters™.",,https://uae.indeed.com/rc/clk?jk=56b0393e897deb8b&fccid=6b4b2a01b2417a65&vjs=3
312,Intensivist,Abu Dhabi,Reyada Home Health Care Services,"To assist, monitor and advise other healthcare professional and provide a commitment to quality assurance programmes.Arabic speaker is a plus.",,https://uae.indeed.com/rc/clk?jk=2e2ef5381008ebfb&fccid=705c674a5c55570e&vjs=3
314,Head of Inclusion,Abu Dhabi,"Repton School, Abu Dhabi - Rose Campus","Annual flight allowance, accommodation provided, and world class medical and healthcare benefits (subject to status).About Repton School Abu Dhabi.",,https://uae.indeed.com/rc/clk?jk=f746c25236509011&fccid=9b648ce28dfa3fbc&vjs=3
315,Legal - Attorney Document Reviewer,Dubai,Royal Brand Corporation,"We provide the best services to more than 1000 corporations from defferent sectors (real estate, manufacturing, electronics, consumer goods, tele communications…",,https://uae.indeed.com/rc/clk?jk=507f5c23b79dbd45&fccid=a5085e7e52c3d148&vjs=3
316,HVAC Technician,Al-Ayn,Al Reem Hospico Co.,Having 05 years’ total experience in Air Conditioning works out of which 03 years’ experience in Healthcare Facility Maintenance is a MUST.,,https://uae.indeed.com/company/Al-Reem-Hospico/jobs/HVAC-Technician-ff2c2358baf8c752?fccid=ae4f90045388cbc8&vjs=3
317,Practical Nurse,Dubai,Enayati Home Health Care Center LLC,"LEADERS IN HOME NURSING, Enayati Home Healthcare utilizes JUNO, Fidelity Nursing Training Mannikin by CAE, Montreal Canada.*.","AED4,000 - AED6,000 a month",https://uae.indeed.com/pagead/clk?mo=r&ad=-6NYlbfkN0D9glK0xKD5q1E0LlS6FtkvHMlFALlP31JBSPUUao8d8Aufb3gWue2rIpc-Jf7WY1I7iXChzmXQLu5bo3Y5FarDf7VBvCOp3kJJE8RFRJNPNqhEnJWWbidC39tchcpLgfkh6H80LzKTDaibnDU1CPY1Rw6nu1BIHcepOn_-8AobaENMmrWGJC31vOIt1F4nXc-xxF8svV4at8SI26d7aYIN10TmI5VaRAAj82pRMKUb1K4UET7ASmpcLILcSURJ2fePtt7eEWqFG-jJ3omSu9CfMSKG48eWZANYnrMwgPS0PIZvY55M0u04GhCSpZ9ucGrjg8v7KAuX0fHZVUYEDkOyGmsS2FcvBC2HJcEja235KjP2DXVYzuQHxhY_LOcaHe1nk6uz4IUPuj_bDNP-5-SPZLKVJAihTYpCFJG8h3yO9s52ut9221RJ&p=12&fvj=1&vjs=3
319,Site Coordinator- Clinical Research,Abu Dhabi,Marc Ellis Consulting,"We are looking for strong experience (5-6 years) in Site coordination, specifically for healthcare projects like Clinical trial.",,https://uae.indeed.com/rc/clk?jk=27288382c746339e&fccid=d25332eb688f9794&vjs=3
321,Home Care Nurse(DHA),Dubai,Legacy Group Services,"Collaborating with doctors and other healthcare professionals to develop improved diets and healthcare plans for patients.Up to AED8,000.00 per month.","AED8,000 a month",https://uae.indeed.com/company/Legacy-H.R-smart-services-FZE/jobs/Home-Care-Nurse-38636bdac3a5c5cb?fccid=61d0a9426f48c9cc&vjs=3
322,"Resident, Surgical Services",Dubai,Fakeeh University Hospital,"3-5 years post qualification experience as Surgical Resident in reputed healthcare setting.Fakeeh University Hospital , a hospital and medical university…",,https://uae.indeed.com/rc/clk?jk=b04a0b8fa4f20afa&fccid=9594544d39556a7a&vjs=3
323,Utilization Managment Specialist - ARE,Dubai,Milliman,Ability to learn value-driven new healthcare concepts and undergo formal certifications for knowledge assessment.The environment is fast-paced and innovative.,,https://uae.indeed.com/rc/clk?jk=5259ad384decf54c&fccid=3d93143c99ff89a3&vjs=3
325,Out-Patient Nurse,Abu Dhabi,Reyada Home Health Care Services,With working experience in a healthcare facility in UAE.We are looking for Out-Patient Nurses with the following qualifications:,,https://uae.indeed.com/rc/clk?jk=950472d117e066b7&fccid=705c674a5c55570e&vjs=3
326,Quality Coordinator,Dubai,RTC-1 Employment Services,The hiring company is one of the leading dental healthcare providers in Dubai and currently have five branches that offers high quality dental care Job Role:,,https://uae.indeed.com/rc/clk?jk=d3a9b193435f5d86&fccid=a0f4df2b71213d85&vjs=3
328,HR Manager,Dubai,First Response Healthcare LLC,First Response Healthcare LLC is a JCI-accredited Home healthcare Organization and we are one of Dubai’s leading Home Healthcare Company.,,https://uae.indeed.com/company/First-Response-Healthcare-LLC/jobs/Human-Resource-Manager-82fa1df0deda4d1a?fccid=338ac8ec172730d9&vjs=3
329,Health Science Teacher,UAE,Applied Technology High School - Al Ain - Male,"Applicants should have a minimum of Bachelor’s Degree in Health related Field (Health Sciences, Nursing, Medical Sciences, Paramedic Sciences, Emergency medical…",,https://uae.indeed.com/rc/clk?jk=3a6cae492d360ad4&fccid=0823f07a65ce232d&vjs=3
330,HAAD Dental Assistant - up to AED7000 - Abu Dhabi,Abu Dhabi,CIMS Medica,Must have a Bachelor's Degree.Must have HAAD/DHA/MOH license (RN or Dental Assistant).Must have dental trainings and certifications.,"AED7,000 a month","https://uae.indeed.com/company/Cims-Medica-FZC-LLC,/jobs/Haad-Dental-Assistant-04702dfb11be70bd?fccid=7f51d8667c592f1e&vjs=3"
331,Business Development Executive,Dubai,Vital Zone Home Health Care Center,We are a Dubai based healthcare company located in Dubai.Our growing company is in need of an experienced and resourceful Business Development Executive to…,"AED4,000 - AED5,000 a month",https://uae.indeed.com/pagead/clk?mo=r&ad=-6NYlbfkN0D0TYb0IgAtsYu7cp_r14tTjpbzMkKNKgPuWLpY8nmvJCMDbKB-doNwVIvR3hOohgl6PQazI2BBQEUSA_Uj-MNnSerjr3v4Vp6mGFFaBFeZettV7EQyJNmfetCzuVsAMLzLHOCgKOIne0ZnKxH8qX0FtWpSTD6OfO3JNeyZpkFCMnU0PmjkQM6UcnSh3tC8c0XiGQKpCgqJikExK-LxMKSWw0i-w9O-1K1S8oOixz29FwPlmjAHgctPHOtRJewUm7A5oiXTFCne3XIF9LJaAbXmIpoZnzTCfptPa6KdVWyG7MrjknGehs1-Hg9bWtzyV0Tb4aEsq3QTziRL2gfArMIoxx8qcYwBIMGxNOmNwXvkoR82gqiI3U1vpXqhuo804pbZtVr6dmhrmhu3ckaz98qncwH9mvYw2iQSVBnqIDjqBkLe9zH5YdWXdL3-sGuNe6iURyUgF46t_1OaUuNCSgnN&p=11&fvj=1&vjs=3
332,Campaign to Enroll Homecare Care Givers for community social...,Dubai,TAMUSH Global in collaboration with Homecare Servi...,"Your training as a healthcare assistant will include basic caring skills and you'll work towards the Care Certificate.Being a Caregiver, you should be*.","AED3,500 a month",https://uae.indeed.com/company/TAMUSH-Global-Project-Management-Services/jobs/Campaign-Enroll-Homecare-Care-Giver-Community-Social-Work-45c5ed6601814033?fccid=c24ac30dced257e0&vjs=3
334,Oracle/PLSQL Developer,Dubai,Neuron,Beneficial to have a Healthcare experience.Proficient in Oracle Developer Suite 10G Forms & Reports.Proficient in Oracle PL/SQL development with designing…,,https://uae.indeed.com/rc/clk?jk=fe59034b061ba27a&fccid=808feefc943a875c&vjs=3
338,Microsoft D365 Functional Consultant,Abu Dhabi,Pharmalink Drug Store,Good experience in Healthcare Domain will be an advantage.We are looking for Microsoft D365 Functional & Report Consultant having good experience in Retail and…,,https://uae.indeed.com/company/Pharmalink-Drug-Store/jobs/Microsoft-Functional-Consultant-d6220d86f2318dd1?fccid=9ad2bde56c0b1979&vjs=3
339,MEP Team Leader,Dubai,ENGIE Cofely,ENGIE Cofely is a regional and international leader in providing low-carbon energy and innovative integrated facilities management solutions in various sectors…,,https://uae.indeed.com/rc/clk?jk=f16fc56504e51296&fccid=5c7269b92dca116c&vjs=3
340,"REGISTERED HOMECARE NURSE - SALARY UPTO 9,000 AED",Abu Dhabi,BAYTI - DMETCO HOME HEALTHCARE LLC,"Assess and chart observations of the patient's condition at each visit.Complete evaluation tasks, including reviewing medication and vital signs.","AED9,000 a month",https://uae.indeed.com/company/BAYTI---DMETCO-HOME-HEALTHCARE-LLC/jobs/Registered-Homecare-Nurse-889002f256ac9a9c?fccid=f719d4218249b283&vjs=3
341,Mobile Technology Specialist,Dubai,Zayed University,"The University’s benefits package is highly attractive, with competitive salaries free of tax in the U.A.E., cash housing, a furniture allowance, annual…",,https://uae.indeed.com/rc/clk?jk=e1f429da417e0f78&fccid=9628b0bd10bde506&vjs=3
342,Home Care Physician - Dubai,Dubai,Axios International,Degree is required with at least 2 years of working experience in a healthcare setting.Work with the healthcare team to provide patients with primary medical…,,https://uae.indeed.com/rc/clk?jk=a474416e90b6ae74&fccid=44566189a0228e5e&vjs=3
343,Product Sales Specialist,Sharjah,Aspen Medical Equipment Trading,"For Medical Equipment- With 2-3 years UAE experience in medical devices sales, UAE driving license and good contacts within the local UAE healthcare sector.",,https://uae.indeed.com/rc/clk?jk=1dd9ef3c34e42f59&fccid=061583ee739118be&vjs=3
344,PODIATRIST,Abu Dhabi,NMC Healthcare,NMC Healthcare is the largest private healthcare company in the UAE and ranks amongst the leading fertility service providers in the world.,,https://uae.indeed.com/rc/clk?jk=537cd119f5474cd9&fccid=d59f4719f5b1f6db&vjs=3
345,Doctors with DHA DHCC - PART TIME,Dubai,DRHC Hospital,"Dubai Healthcare City, High class premium Hospital.A well renowned private Hospital, Dubai.Specialty Doctors (Surgeons / Clinicians) - Part time Revenue…",,https://uae.indeed.com/company/Dr-Rami-Hamed-Center/jobs/Doctor-Dha-Dhcc-01bd4d54af3e3cf2?fccid=48b5a6e70371002e&vjs=3
347,NURSE/GP/DENTIST & SPECIALIST/PHARMACIST/MEDICAL CODER/RECEP...,Dubai,Houston Clinic,"REQUIREMENT FOR STAFF NURSE/ GENERAL PRACTITIONER ( PART-TIME), DERMATOLOGIST & PATHOLOGIST(PART-TIME), GENERAL DENTIST (FRESHER WILL BE TRAINEE FOR 6 MONTHS or…","AED2,500 - AED6,000 a month",https://uae.indeed.com/pagead/clk?mo=r&ad=-6NYlbfkN0CoScAF7uFKezAAK1J8diNwTIKaJl3rcS2WA1tzqvf9NBdA7ZoXUkUO-r9f6OK8yN8RzGWuWjGU8GbGVLNHSGDtPyP_qJ7wI41wcTUnA5Mm0LgZjH3NUS8kIttqLXwTxnFdw97e3jw42Rc8ImHuemQBH2Ow35dWBv-bkWAwrLUuj6SUK4mn66qWptjyD1aicc4agml6LTAgqLrubIZ_7fbR8_iQMzo8fI8IIH3rqeBo_LPa2jQX_ii2T3ei7-lwW2opn7nXadEoPxWO5TYqjeVgdmh71ifH72t0UAZvLvENvtVT6Dw5zVoBPWV_ldPmZIfmEfjMCMXjKOfi5yOya0tn3o-9plVoh-g5TPkI8AwbWFYplDPUWDP4cH1sRhVs1NgmtiM32f8aW6JRVZi726YoK2MWbi5RDjhkdJThCxP6hTik0gMrxUrlW8eb1lSG2hqtiIz96X1W5L1wVChOJ98IRkYfkNqAlUAanU6rC1FytQ==&p=12&fvj=1&vjs=3
349,Registered Nurse,Abu Dhabi,Al Bustan Medical Center,"Responsible for providing safe, effective, evidence based & comprehensive nursing care as part of the multidisciplinary team within the healthcare facility.",,https://uae.indeed.com/company/international-Dental-Center/jobs/Registered-Nurse-a9c245151e8997e4?fccid=8a33f3daabadf00d&vjs=3
350,Site Engineer,Dubai,Omni International,"For over 15 years Omni International Consultants has supplied high caliber personnel to the global Construction, Aviation, Banking, Logistics, IT, Hospitality,…",,https://uae.indeed.com/rc/clk?jk=9ecf60776ac11e54&fccid=eb525ce63ed76336&vjs=3
352,Specialist /Consultant - Medical Oncologist,Abu Dhabi,Search Plus HR,"Leading a cancer treatment team of various healthcare professionals.We are looking for a caring, dedicated Oncologist to join our team in diagnosing, treating,…",,https://uae.indeed.com/rc/clk?jk=b0a6dd8777c52690&fccid=618066ca5559b1d4&vjs=3
353,Junior Associate - Corporate M&A (Dubai),Dubai,Baker McKenzie,"Consumer Goods & Retail, Energy Mining & Infrastructure, Financial Institutions, Healthcare, Industrials, Manufacturing & Transportation, Technology, Media and…",,https://uae.indeed.com/rc/clk?jk=833254d98eb6053d&fccid=06ce31f83eef4b47&vjs=3
354,"Medical Science Liaison, GEM",Dubai,Acino Pharma,"Effectively manage risk and ensure compliance within the organization as well as knowledge of Healthcare systems.Dubai, UAE, Middle East, Turkey, and Africa.",,https://uae.indeed.com/rc/clk?jk=98db04344f728d85&fccid=203459eff15314bf&vjs=3
355,Clinical Operations Manager,Dubai,Specialist Medical Clinic,"We are a market leading (Permanent) Staffing Services provider dedicated to sourcing niche skilled and high caliber talent such as Doctors, Nurses, Midwives,…","AED35,000 a month",https://uae.indeed.com/company/Kare-Plus-MENA/jobs/Clinical-Operation-Manager-2325fd484b141121?fccid=055308cc62e6e80b&vjs=3
356,Conceptual Designer,Dubai,Robinson Faris Jones - Human Resources (RFJ-HR),"Healthcare, mixed use, hospitality and commercial developments;Boutique Design office with a range of medium to large scale projects:",,https://uae.indeed.com/rc/clk?jk=562bbf45b41ab4c0&fccid=40e1507cf13642c4&vjs=3
357,Registered Nurse I Healthcare I Dubai- UAE,Dubai,Al-Futtaim,"As a humble family business that started on the banks of the Dubai Creek in the 1930s, Al-Futtaim has expanded to a presence in 31 countries, a portfolio of…",,https://uae.indeed.com/rc/clk?jk=4a2041202e593f8f&fccid=b5139e4031867414&vjs=3
358,Regional Service Excellence Manager,Dubai,AXA,"Extensive knowledge of Healthcare Insurance.UNITED ARAB EMIRATES-UNITED ARAB EMIRATES-DUBAI.Designs, leads and oversees the implementation of AXA Employee…",,https://uae.indeed.com/rc/clk?jk=89d4a016b0990392&fccid=753062d67d31c43a&vjs=3
359,Male General Practitioner,Dubai,Vida Clinics LLC,Well reputed multi specialty Polyclinic and Home Healthcare Services required Male General Practitioner.Personal protective equipment provided or required.,,https://uae.indeed.com/company/Vida-Clinics-LLC/jobs/Male-General-Practitioner-132007317f82a086?fccid=54009a0f113323db&vjs=3
360,HAAD Home Care Nurse,Abu Dhabi,CIMS Medica,"Minimum 2 Years of working experience.Must have HAAD License/Eligibility letter.Must have Bachelor’s Degree in Nursing.UP to 11,500 AED /month.","AED8,000 - AED10,000 a month","https://uae.indeed.com/company/Cims-Medica-FZC-LLC,/jobs/Haad-Home-Care-Nurse-027d7fe049e584e1?fccid=7f51d8667c592f1e&vjs=3"
361,Nurse Assistant,Dubai,City Doctor Healthcare,City Doctor Healthcare is urgently hiring for Nurse Assistant(s) to join our Home Care Division Team.Nurse Assistant is providing treatment to patients with a…,,https://uae.indeed.com/company/City-Doctor-Healthcare/jobs/Nurse-Assistant-e0a1d085cf1d65b1?fccid=b4011dd9e9eb5adb&vjs=3
362,MOH/DHA Patient Support Program Nurse - UAE,Dubai,Axios International,A BS Degree in Nursing is required with at least 2 years working experience in a healthcare setting.The Patient Support Nurse provides comprehensive nursing…,,https://uae.indeed.com/rc/clk?jk=a0cfa9274c107454&fccid=44566189a0228e5e&vjs=3
363,Pharmacist InCharge(Store)-with HAAD & MOH license,Abu Dhabi,Pharmalink,"Responsible for day to day operations including regulatory compliance and supervise receiving, warehousing, picking/packing and dispatch, in order to meet…",,https://uae.indeed.com/rc/clk?jk=061bbb0e0d1ed724&fccid=71391635dec2c0ae&vjs=3
364,Beauty Therapist with Nursing Background,Abu Dhabi,"Primexperts Healthcare, Training And Consultancy",Relevant qualification in Beauty Therapy.An active license to practice beauty therapy.Proven experience working in the beauty industry.,"AED6,000 a month","https://uae.indeed.com/company/Primexperts-Healthcare,-Training-And-Consultancy/jobs/Beauty-Therapist-Nursing-Background-51263866e6231f54?fccid=460f9c289d11e23d&vjs=3"
365,LASER TECHNICIAN WITH HAAD/DHA,Abu Dhabi,NMC Healthcare,NMC Healthcare is the largest private healthcare company in the UAE and ranks amongst the leading fertility service providers in the world.,,https://uae.indeed.com/rc/clk?jk=07aa86b2329a8558&fccid=d59f4719f5b1f6db&vjs=3
366,Market Access Head,Dubai,Abbott Laboratories,In-depth knowledge about the country’s healthcare system and MA decision making.Responsible for the country overall market access strategy and execution for…,,https://uae.indeed.com/rc/clk?jk=943847b82d660357&fccid=7942658690eba67c&vjs=3
367,Occupational Therapist - HAAD,Abu Dhabi,Brainstorm Human Resources Consultants,Required Arabic Occupational Therapist for a major healthcare group in UAE.Valid HAAD/ DHA/ MOH license.2 to 3 years of experience as Occupational Therapist…,"AED18,000 - AED20,000 a month",https://uae.indeed.com/company/Brainstorm-Human-Resource-Consultants/jobs/Occupational-Therapist-163cc66173863649?fccid=b0bc31d2ce72d680&vjs=3
368,Specialist Gynecologist in DHA sector,Dubai,Search Plus HR,Referring patients to other healthcare specialists as needed.We are looking to employ a dedicated and experienced Obstetrics & Gynecologist to diagnose and…,,https://uae.indeed.com/rc/clk?jk=c0e47ead64cb616e&fccid=618066ca5559b1d4&vjs=3
369,Business Development Manager - Foodservices,Dubai,Talabat,"As part of the Delivery Hero network, Talabat is the pioneer of the online food ordering industry in the Middle East.To develop the business cases.",,https://uae.indeed.com/rc/clk?jk=e7100773cccfc7db&fccid=8948005a95e365ae&vjs=3
370,Legal Counsel,Dubai,MPC Healthcare,"Review contracts including but not limited to contracts with suppliers and vendors, employment contracts, terms and conditions, non-disclosure agreements.",,https://uae.indeed.com/company/MPC-Healthcare/jobs/Legal-Counsel-b7240514220a4e10?fccid=0a5a1088568eadf6&vjs=3
371,Doctors - Revenue Sharing DHCC DHA Part Time,Dubai,DRHC Hospital,"Dubai Healthcare City, High class premium Hospital.A well renowned private Hospital, Dubai.Who already practicing in Dubai or in DHCC (having own patients).",,https://uae.indeed.com/company/Dr-Rami-Hamed-Center/jobs/Doctor-2f924709f3c724cb?fccid=48b5a6e70371002e&vjs=3
372,Chief Financial Officer (CFO) – Pharmaceutical Company (Duba...,Dubai,OnePoint,"Minimum 10 years of experience working for a major group or a large corporation in the healthcare industry.Manage processes for financial forecasting, budgets…",,https://uae.indeed.com/rc/clk?jk=db92fdd2af9b0af0&fccid=f15e5e4a46544874&vjs=3
373,DHA Pharmacist,Dubai,Medseven Healthcare Group,Minimum 1 to 2 Years of UAE Experience as a Pharmacist.Ready to join as soon as possible.Social distancing guidelines in place.,"AED3,000 - AED4,000 a month",https://uae.indeed.com/company/Medseven-Healthcare-Group/jobs/Dha-Pharmacist-8951895653cfcdfa?fccid=8d4ffa2a7c6133b7&vjs=3
374,Nursing Aide,Al-Ayn,ORTHOPLUS BONE AND JOINT CENTER LLC,"Vacancy in a multi specialty medical center with JCI accreditation in Town Center, Al Ain.Preference will be given for candidates based in Al Ain.","AED2,500 a month",https://uae.indeed.com/company/Orthoplus-Bone-and-Joint-Center/jobs/Nursing-Aide-c81728ece7f676d8?fccid=c35e4d36c04a0c32&vjs=3
376,Dental Assistant,Sharjah,Bin Haian Healthcare group,We are currently looking for Experienced Dental assistant with MOH License.But at least have 2 years Experience working in Dental Clinic.,"AED4,000 - AED7,000 a month",https://uae.indeed.com/pagead/clk?mo=r&ad=-6NYlbfkN0CHQqMcmqEs6FadTiMBBh_COFAus-3m3dsoTsGQG7CJcP0JLRT0s5TTjMDxGbShJm7nqrW4Hdvy1fAddsPO0TYlBj809A4JsFgdnABHw6EYCD8Q-mOQRmeAPqOWigUx8x1NvoE9UMoGr1f8Q1Yljgo4ECUcpVud_ujW8P1Ppw70zwtZ8JpYBmwsB5BCbqRe0zwJ0hb5eDsqOPeIVsmwlQefOHfdOc13FbUiztOZgUrvHO79ezXydb-vYTF6i4Whpk2k6y0zoNbKjNL_hBa1ph9C141FioTVWPtKDRyiBQs3rMOrThhcupdXX2hEt9PxFRhpT_xTTtj7Ty0ftn6V7XiovexNX9ZBre0aQisnD-l_oPhzV6U38LuGpEVX0CsQ_Xf0Jecx-XDBwVpSk7Cq-ZXQPzSAahoDIW3X3M8SEpTDfmgZ1GPwAKj6MonFKq4Ih4U=&p=11&fvj=1&vjs=3
378,Experienced Out-of-Hospital Midwife,Dubai,Rise Birth Center,"Consults with and refers to community healthcare members as needed.Rise is comprised of people passionate about birth rights for women, creating more options…","AED24,000 a month",https://uae.indeed.com/company/Rise-Birth-Center/jobs/Experienced-Out-Hospital-Midwife-446c9514e6e20615?fccid=f63db7f0ee551b91&vjs=3
379,Charge Nurse-Emergency Department,Sharjah,University Hospital Sharjah,"To excel in this role, you will need to be a licensed nursing professional with at least three years of experience in a healthcare environment.",,https://uae.indeed.com/rc/clk?jk=74efeacbae25723b&fccid=20e48137bc4f99a9&vjs=3
380,Adult Intensivist,Dubai,Fakeeh University Hospital,"Fakeeh University Hospital , a hospital and medical university project, is developed by Saudi Arabia’s leading healthcare provider, Fakeeh Care, in an effort to…",,https://uae.indeed.com/rc/clk?jk=ef85d5ff9cc5811d&fccid=9594544d39556a7a&vjs=3
381,Sales Manager,Dubai,Napier Healthcare Solutions Pte. Ltd.,Develop a solid understanding of customer needs and market drivers in the healthcare industry.Identify opportunities and build business cases for development…,,https://uae.indeed.com/rc/clk?jk=6eb2a9319dbdddba&fccid=1c5cfc525b841c32&vjs=3
382,Registered Nurse,Abu Dhabi,ubc world,"We are a well-reputed Healthcare Provider based in the heart of Abu Dhabi, as a part of an expansion of our services we are currently hiring Registered Nurses…",,https://uae.indeed.com/company/Ubc-world/jobs/Registered-Nurse-bec57ac8ada351ca?fccid=1cc855e885a7e2cc&vjs=3
383,"CRM/SFE Analyst - Central & Eastern Europe, Middle East and...",Dubai,Medtronic,"Together, we can change healthcare worldwide.Let’s work together to address universal healthcare needs and improve patients’ lives.A Day in the Life.",,https://uae.indeed.com/rc/clk?jk=59119415495e7584&fccid=f06a4d05bf5510ec&vjs=3
384,Consultant Radiologists (Remote),Dubai,Prognica Labs,Prognica is shaping the next generation of diagnostic healthcare tools to help patients around the globe.Board Certified with 2+ years of post-residency or…,,https://uae.indeed.com/rc/clk?jk=d3d9fa69d4dedd7f&fccid=71590b46c05f8c89&vjs=3
385,Staff Nurse: Operating Room,Al-Ayn,Kanad Hospital,"Inter-professional healthcare and quality improvement:Collaborates with the healthcare consumer, family, and others in the conduct of nursing practice.",,https://uae.indeed.com/rc/clk?jk=1237524229f04cc2&fccid=67e1f7568e1ff843&vjs=3
386,Female Practical Nurse / PN,Abu Dhabi,Private healthcare facility,"- Female - DOH Passer - flexible and hardworking Job Types: Full-time, Permanent Work Remotely: *…",,https://uae.indeed.com/company/GULF-INTERNATIONAL-MEDICAL-SERVICES/jobs/Female-Practical-Nurse-da011c0933aa39eb?fccid=b5975c11b5e58833&vjs=3
387,Enterprise Architect,Dubai,Zayed University,"The University’s benefits package is highly attractive, with competitive salaries, housing, a furniture allowance, annual vacation airline tickets for the…",,https://uae.indeed.com/rc/clk?jk=256f062f3013acd5&fccid=9628b0bd10bde506&vjs=3
388,Media Services Technician,Dubai,Zayed University,"The University’s benefits package is highly attractive, with competitive salaries free of tax in the U.A.E., Cash housing, a furniture allowance, annual…",,https://uae.indeed.com/rc/clk?jk=7967d902672a5192&fccid=9628b0bd10bde506&vjs=3
389,DHA/MOH Pharmacist,Dubai,Medseven Healthcare Group,2.Minimum 1 to 2 years experience in UAE.Good Communication Skill and Subject Knowledge.Social distancing guidelines in place.,"AED4,500 - AED6,500 a month",https://uae.indeed.com/company/Medseven-Healthcare-Group/jobs/Dha-Moh-Pharmacist-cbee6ed656817eea?fccid=8d4ffa2a7c6133b7&vjs=3
391,Assistant and Associate Professor in Cyber / Information Sec...,Abu Dhabi,Zayed University,"The University’s benefits package includes salary free of income tax in the UAE, housingallowance, furniture allowance, annual vacation airline tickets for the…",,https://uae.indeed.com/rc/clk?jk=98bce1289e2ca463&fccid=9628b0bd10bde506&vjs=3
