,title,location,company,summary,salary,url
480,Front Desk Receptionist,Fujairah,Global Career Heights (GCH),Experience in the Hospitality or Healthcare industry MUST.FRONT DESK REPRESENTATIVE CUM RECEPTIONIST.Ready to relocate to UAE.,"AED2,000 - AED3,000 a month",https://uae.indeed.com/company/Global-Career-Heights-(GCH)/jobs/Front-Desk-Receptionist-a61bb75ec54f3314?fccid=c2ad4fff5701aa2e&vjs=3
481,Data Application Engineer,Abu Dhabi,Marc Ellis Consulting,Experience in the healthcare sector and/or knowledge of healthcare data systems and/or clinical information systems.,,https://uae.indeed.com/rc/clk?jk=96f31a7b84c5af8f&fccid=d25332eb688f9794&vjs=3
482,Senior Service Engineer,Dubai,Horizon Medical Supplies,Bachelor/Master Degree- Bio Medical Engineering.Any Nationality – (Male)- Preferable Arabic.Minimum 4-5 years and 2-3 years in UAE.,,https://uae.indeed.com/rc/clk?jk=1f3d04b1c673726c&fccid=818f7691bbea46a3&vjs=3
484,Specialist ENT (HAAD / DOH),Abu Dhabi,Davidson Management Consultants,Davidson Management Consultants have been mandated to recruit a native Arabic speaking Specialist ENT for their client which is a multinational european…,,https://uae.indeed.com/rc/clk?jk=1f7f2bd5a9756324&fccid=d3f7b35de7842821&vjs=3
485,Service Engineer - Laboratory,Dubai,Horizon Medical Supplies,Bachelor/Master Degree- Bio Medical Engineering.Any Nationality – (Male)- Preferable Arabic.Minimum 4-5 years and 2-3 years in UAE.,,https://uae.indeed.com/rc/clk?jk=a7e5cb5d7ddf050d&fccid=818f7691bbea46a3&vjs=3
486,Specialist Oral and Maxillofacial Surgeon,Dubai Free Zone,Medical Specialists Centre,"We are looking for an experienced Specialist Oral & Maxillofacial surgeon, to join the growing healthcare team.Licensed to practice as an Oral Surgeon.",,https://uae.indeed.com/company/Healthcare-clinic/jobs/Specialist-Oral-Maxillofacial-Surgeon-055a9ad3b53f3bac?fccid=7bf49baed8817467&vjs=3
487,Male Registered Nurse for Home Care,Abu Dhabi,Via Medica Intl,Via Medica International Healthcare LLC is continuously looking for Male - Registered Nurse(s) to be part of our Home Care Division - Abu Dhabi.,,https://uae.indeed.com/rc/clk?jk=9be3bca397d85976&fccid=03a1b11f55201a40&vjs=3
488,Emergency Medicine Consultant - International Hospital,Sharjah,Omni International,"For over 15 years Omni International Consultants has supplied high caliber personnel to the global Construction, Aviation, Banking, Logistics, IT, Hospitality,…",,https://uae.indeed.com/rc/clk?jk=ca68b6cb6f228fa4&fccid=eb525ce63ed76336&vjs=3
489,Consultant Paediatric Neurologist - Abu Dhabi,Abu Dhabi,Medacs Healthcare,A wonderful opportunity available for an experienced Consultant Paediatric Neurologist in Abu Dhabi!We are currently looking for an Consultant Paediatric…,,https://uae.indeed.com/rc/clk?jk=bf16fe089cc324ce&fccid=aebff11e33fbbd12&vjs=3
490,Head of Finance,Dubai,Robert Walters,Must have Healthcare or Clinic related Finance Experience.Minimum 5 years’ working experience in Head of Finance role in a Healthcare business or Clinic.,,https://uae.indeed.com/rc/clk?jk=44070e7c11133e09&fccid=f01c2f55ec3054bf&vjs=3
491,Social Media Manager,Dubai,Inside Ideas,"In September 2019, IIG were awarded a contract by a market-leading healthcare brand to create agencies inside the brands leading offices around the world.",,https://uae.indeed.com/rc/clk?jk=166a8f4d51c43c83&fccid=b45966c2e32e6bba&vjs=3
492,Therapeutic Area Manager CMC - Based in Lebanon,Dubai,Merck KGaA,"Our 57,000 people are shaping how the world lives, works and plays through next generation advancements in healthcare, life science and Electronics.",,https://uae.indeed.com/rc/clk?jk=005b3b0d2e716f99&fccid=68d0e0954a811351&vjs=3
493,DERMATOLOGIST,Dubai,Dubai Herbal & Treatment Centre,"Carrying out applied research, adding to the evidence base of practice in a variety of healthcare settings.Examines and diagnoses disorders and diseases of the…",,https://uae.indeed.com/rc/clk?jk=86eca916a5e5c640&fccid=29e196e7edf04f8a&vjs=3
494,Business Development Head / General Manager,Ajman,Medicom,Development of new businesses in the HEALTHCARE & LABORATORY market.10 years experience in laboratory & healthcare business proven track record in business…,,https://uae.indeed.com/rc/clk?jk=97cb60d8de497518&fccid=cb41f76c0c4d010b&vjs=3
495,Senior Product Designer,Dubai,Halian - UAE,"Our knowledge base covers a variety of industry sectors including Government, Healthcare, Telecommunications and Pharmaceuticals, as well as a specialist…",,https://uae.indeed.com/rc/clk?jk=e51c6ef791ccbd07&fccid=57544703f0a3fc01&vjs=3
496,Raw / Vegan Chef,Ajman,Zoya Health & Wellbeing Resort,"We are looking for a Raw / Vegan Chef with knowledge in nutrition, plant-based raw, vegan and juicing.You will be responsible for the whole F&B operation,…",,https://uae.indeed.com/rc/clk?jk=4935d2ae22742295&fccid=c922002c2bf93594&vjs=3
497,Dermatologist,Dubai Healthcare City,Westminister Ortho Med Clinic,Evaluating patient skin conditions by screening for disease.Utilizing patient medical history as part of assessments.Work with an EMR system.,,https://uae.indeed.com/company/Westminster-Ortho-Med-Clinic/jobs/Dermatologist-3921229b9bab98b1?fccid=e6b9edb61ff0fcb6&vjs=3
498,Dental Assistant,Dubai Healthcare City,myPediaclinic FZ LLC,Aids the dentist and other healthcare providers in the clinic in providing excellent healthcare service.Dental Assistant needed at a reputable clinic in Dubai…,,https://uae.indeed.com/company/myPediaclinic-FZ-LLC/jobs/Dental-Assistant-939cc542370b97e1?fccid=d9d7b1210ee991aa&vjs=3
499,DHCC Licensed Dermatologist (Part Time),Dubai Healthcare City,American Wellness Center FZ-LLC,DHCC Licensed Dermatologist (Part Time).,,https://uae.indeed.com/company/American-Wellness-Center-FZ--LLC/jobs/Dhcc-Licensed-Dermatologist-7418044213061cb7?fccid=34bfc03ca314893e&vjs=3
500,Nurse Manager - Corporate I Healthcare I Dubai- UAE,Dubai,Al-Futtaim,"As a humble family business that started on the banks of the Dubai Creek in the 1930s, Al-Futtaim has expanded to a presence in 31 countries, a portfolio of…",,https://uae.indeed.com/rc/clk?jk=8e8792ca1f09624a&fccid=b5139e4031867414&vjs=3
501,Registered Nurse,Dubai,Expert Care,Preferable Hospital or a Home Healthcare Agency.Collaborates with physicians and multidisciplinary team members.And evaluating new equipment and techniques.,"AED7,000 a month",https://uae.indeed.com/company/Expert-Care-DMCC/jobs/Registered-Nurse-0922320f822aa357?fccid=a407253979f3c1ad&vjs=3
502,Dental Technician,Sharjah,Bin Haian Healthcare group,"We Need experinced dental technician of all specialities:Ceramic,emax,wax up, plaster and CAD/CAM tech.Personal protective equipment provided or required.",,https://uae.indeed.com/pagead/clk?mo=r&ad=-6NYlbfkN0CHQqMcmqEs6FadTiMBBh_COFAus-3m3dsoTsGQG7CJcKfFKtJMZvuoAevOmIBYhcELmom1gAQ1am65C0zibYjMRp9ccgieGd0udjsnX1DiBEwcIHQI4Y5sG0CC7Q64usLuKFr6qQwNs8_zLFSAfNGQZatg91XfxeHRhH_pNWS29DSbEX7pK0pA1TBCplFfheIFtHV0kwKxTW44I8MA7sR1f9olpykxmDCiEOhcQ3DFa7PWnxOQa6EpLr9W6SzECVQFq6SKBGQu3W8KjYVzTrlKWNs0nrmFXInkqGylnUpQN2WQihA1dmfHgvmvPJVAk1ysQHkjeph1-SaSI5jL7CeGBCDHtWSJqLb8cfk3tfDJzEGNvhN5AzFt8wvk-_bPCltbXm49BlQZvOWP_Dmoy4CQq683ozjaH6CF8Cb2Q6VPxNY8ookvvxIInvM0SMTDzyc=&p=14&fvj=1&vjs=3
503,Account Director- Automotive Account,Dubai,Digitas,Experience in healthcare communications environment preferred.Part of the Publicis Groupe;At Digitas we believe there are better ways for brands to connect…,,https://uae.indeed.com/rc/clk?jk=2b721635bf931e0b&fccid=274e15dee00b5237&vjs=3
504,Professional Services Engineer - Dubai,Dubai,vArmour Networks,"At vArmour, our mission is to protect what's important.For our hundreds of customers around the world, that's their data - the lifeblood of today's modern…",,https://uae.indeed.com/rc/clk?jk=f333c1691bee3599&fccid=f412f99fa1704a5d&vjs=3
509,Registered Nurse,Fujairah,Thumbay Hospital Fujairah,Looking for Registered Nurse who can join with us immediately with our leading healthcare facility based here in Fujairah.,"AED5,000 a month","https://uae.indeed.com/company/Thumbay-Hospital,-Fujairah/jobs/Registered-Nurse-26c74089d05c310f?fccid=6d5c1837efb4ca6a&vjs=3"
511,Gynecologist - Part-time,Dubai,Trovec Management Consultancy,"You have good working experience in Dubai with reputed Healthcare group.We are looking for a passionate ""Gynecologist"" in Dubai, UAE location.","AED10,000 a month",https://uae.indeed.com/company/Trovec-Management-Consultancy/jobs/Gynecologist-be8f2e670033e5e7?fccid=30ea59f4c9f72189&vjs=3
512,Staff Nurse: Pediatric Clinic (Females ONLY),Al-Ayn,Kanad Hospital,"Inter-professional healthcare and quality improvement:Collaborates with the healthcare consumer, family, and others in the conduct of nursing practice.",,https://uae.indeed.com/rc/clk?jk=dac96648c1343299&fccid=67e1f7568e1ff843&vjs=3
514,Registered Dental Hygienist,Dubai,Drs Nicolas & Asp Center,Nicolas & Asp is the Largest Private Dental Healthcare Provider in the United Arab Emirates.Complete periodontal examination and charting and use indices to…,,https://uae.indeed.com/company/Drs-Nicolas-&-Asp/jobs/Registered-Dental-Hygienist-617d1d447dc7a8a6?fccid=37172cc13f70fe2e&vjs=3
516,Digital Marketing Executive (Clinics),Dubai,Middle East Executive,"We are currently recruiting for a Senior Digital Marketing Executive for a regionally well known healthcare clinic that have a number of clinics, based in Dubai…",,https://uae.indeed.com/rc/clk?jk=4b90c04669877250&fccid=c9314f6c4cac61a0&vjs=3
517,Field Marketing Manager METAI,Dubai,Beckman Coulter Life Sciences,Beckman Coulter Life Sciences’ mission is to empower those seeking answers to life’s most important scientific and healthcare questions.,,https://uae.indeed.com/rc/clk?jk=97342b38d23402b6&fccid=432c7642003cc768&vjs=3
518,Female Home Care Nurse,Abu Dhabi,OilExec,Must have a minimum 2 years working experience in a HealthCare Facility.Monitor/Assess patient's condition • Preparation and/or administration of medications •…,,https://uae.indeed.com/rc/clk?jk=7cd42cad530dbdc0&fccid=a74d78ce311f3991&vjs=3
519,Chiller Technician,Dubai,ENGIE Cofely,ENGIE Cofely is a regional and international leader in providing low-carbon energy and innovative integrated facilities management solutions in various sectors…,,https://uae.indeed.com/rc/clk?jk=7a3dcb80d47893b0&fccid=5c7269b92dca116c&vjs=3
520,Research Assistant - Grant,Al-Ayn,United Arab Emirates University (UAEU),Previous working experience in healthcare settings or in government health services would be an advantage.Job Description Research Assistant position with the…,,https://uae.indeed.com/rc/clk?jk=32e5e4f0665743e6&fccid=b41c0daaeee4e303&vjs=3
522,"Legal and Compliance Director, Middle East, Turkey and Afric...",Dubai,Acino Pharma,He/she needs to have solid experience working in the region for an international or reputable local business in the healthcare industry.,,https://uae.indeed.com/rc/clk?jk=392262a212903fd7&fccid=203459eff15314bf&vjs=3
523,Tissue Viability Nurse,Abu Dhabi,Black Pearl Consult,"Our client, a well-known healthcare facility in UAE is currently recruiting for the position of Tissue Viability Nurse to be based in Abu Dhabi.",,https://uae.indeed.com/rc/clk?jk=4bb4ede63d570f85&fccid=e9d731aa91b2d791&vjs=3
524,Business Development Engineer (Fire Fighting Industry),Dubai,Al Shirawi Fire Fighting Systems Installation & Ma...,"Al Shirawi Fire Fighting Systems provides Supply, Installation and Maintenance Solutions for Residences, Retail, Healthcare, Education, Hospitality, Industrial,…",,https://uae.indeed.com/company/Al-Shirawi-Fire-Fighting-Systems-Installation-&-Maintenance-LLC/jobs/Business-Development-Engineer-bad82a0b21c5c60b?fccid=48bd13b1bca22712&vjs=3
525,Sr.Sales & Product Specialist - Laboratory,Dubai,Horizon Medical Supplies,Bachelor/Master Degree- Science/Bio Medical Engineering.Any Nationality – (Male)- Preferable Arabic.Minimum 4-5 years and 2-3 years in UAE.,,https://uae.indeed.com/rc/clk?jk=263c4b220cd4a918&fccid=818f7691bbea46a3&vjs=3
526,CHANNEL SALES (HEALTHCARE/DATA ANALYTICS/HIS) (30272),Dubai,Nadia,"Company has deep technical, clinical, and analytical expertise, and works with healthcare providers across India, South Asia, GCC, SEA.",,https://uae.indeed.com/rc/clk?jk=3a5972b0cbb892fe&fccid=8b9276424d9ed4df&vjs=3
527,Property Consultant,Dubai,Dubai Investments,"The Company has grown exponentially with investments in a number of businesses across sectors - real estate, manufacturing & industrial, healthcare, education…",,https://uae.indeed.com/rc/clk?jk=81540de10a69ea1b&fccid=159192311038adf9&vjs=3
529,Nephrology Specialist - Abu Dhabi,Abu Dhabi,Medacs Healthcare,A wonderful opportunity available for an experienced Nephrologist in Abu Dhabi.We are currently looking for a Nephrologist in for an extremely well established…,,https://uae.indeed.com/rc/clk?jk=55ea0c06130983fe&fccid=aebff11e33fbbd12&vjs=3
530,Female Home Care Nurse / Caregiver,Dubai,Healthcare,"Urgently hiring, Female Homecare Nurse/caregiver for a homecare company located in Dubai.Must be able to join immediately.Yearly vacation leaves with pay.",,https://uae.indeed.com/pagead/clk?mo=r&ad=-6NYlbfkN0AwjvHhW3L6GOEBaXKN53I1yJ98W4FNJ83zeMSDUscV9NtioM3XSrxcx5yxVlBT8WohmEvU60hQC8CzIYB-c40PiN-hTVKpqQ-AegR_NxvU5cu3pY-Fy-Zrp6SzotSWkzSB0g5QC5HdQcWNCMgEHMzzdBJlIvWaiD_PNFlMMgexkw9GrDuplyZkqx8CSxzLdP6EHxpPQb24qd0Eehd3pwDZUulOWBqmAaeb90P8RCJe7VeoYb0aH6aiotAXq-RNJPtn1hvSzOJC13Yjb2LZtw0jGYqbtjXUgiLPRQ0uGjpx7k2oeN7WDogGUxCyEoi1PIDam7vjx9SAIiZnKqIxP-C49B-Vr0AYf2tBxaV0WFov-UrxO_lyOKqS9YjI8z4YrhvmW4QzvjouuH1ZGkg-CRQGxEcB8znoBUZVjM3nrxVovn2TzlARsI3SVrWM6XHnhrp9gZ61gazWKA==&p=12&fvj=1&vjs=3
531,Assistant Professor Midwifery,UAE,Fatima College of Health Sciences (FCHS),"Fatima College of Health Sciences (FCHS) was established by the Institute of Applied Technology in 2006, an aim to meet the United Arab Emirate’s growing need…",,https://uae.indeed.com/rc/clk?jk=dfb62d9962f85051&fccid=68b857f6f4af30bd&vjs=3
533,Consultant Neonatologist.,Abu Dhabi,Davidson Management Consultants,This hospital is known not only for its high quality of healthcare services but also for its commitment to the medical welfare of the society at large through…,,https://uae.indeed.com/rc/clk?jk=688df47e28ce088d&fccid=d3f7b35de7842821&vjs=3
534,Specialist Neurologist (HAAD / Passer),Abu Dhabi,Davidson Management Consultants,This hospital is known not only for its high quality of healthcare services but also for its commitment to the medical welfare of the society at large through…,,https://uae.indeed.com/rc/clk?jk=c059434c70e139bd&fccid=d3f7b35de7842821&vjs=3
535,pharmacist,Dubai,Irham healthcare,"Pharmacist with DHA license , flair for sales and customer service , therapeutic knowledge ,.Go get attitude , able to focus on sales .",,https://uae.indeed.com/company/ALQAREIN-PHARMACY/jobs/Pharmacist-6e7e26caf8e612d8?fccid=4c9720a045ab0fc0&vjs=3
536,Specialist ObGyn / Gynecologist - DOH/ HAAD licensed,Abu Dhabi,Davidson Management Consultants,Davidson Management Consultants have been mandated to recruit a native Arabic speaking Specialist ObGyn for their client which is a multinational european…,,https://uae.indeed.com/rc/clk?jk=5af1d4b74641fe2d&fccid=d3f7b35de7842821&vjs=3
537,PEDIATRICIAN,Dubai,Dubai Herbal & Treatment Centre,"Carrying out applied research, adding to the evidence base of practice in a variety of healthcare settings.Advise patients, parents or guardians and community…",,https://uae.indeed.com/rc/clk?jk=3c79103658797d45&fccid=29e196e7edf04f8a&vjs=3
538,Innovation Senior Manager,Dubai,Accenture,"Business Insights consulting in multiple Industries such as, Communication & Media, Financial Services, Retail, FMCG, Travel, Public Services, Healthcare,…",,https://uae.indeed.com/rc/clk?jk=25196a2ac753ab05&fccid=a4e4e2eaf26690c9&vjs=3
539,Inclusion Teacher,Al Barsha,Foremarke School - Dubai,Annual flight allowance and global healthcare plan.Foremarke School Dubai is seeking an outstanding Inclusion Teacher to start August 2021.,,https://uae.indeed.com/rc/clk?jk=6380103bc18aa665&fccid=c9b5ca30c9860474&vjs=3
540,Registered Nurse for Home Care Division,Abu Dhabi,Via Medica Intl,Via Medica International Healthcare LLC is continuously looking for Registered Nurse(s) to be part of our Home Care Division - Abu Dhabi.,,https://uae.indeed.com/rc/clk?jk=4fe9f123d83e3bf5&fccid=03a1b11f55201a40&vjs=3
541,Specialist Ophthalmologist,Dubai,al wasl medical clinic,"We are looking for an experienced Specialist Ophthalmologist on Percentage base 50%, to join the growing healthcare team.",,https://uae.indeed.com/company/al-wasl-medical-clinic/jobs/Specialist-Ophthalmologist-9829a6522b42223a?fccid=93a49065d42de8aa&vjs=3
542,Electroneurodiagnostic Technologist,Abu Dhabi,NMC Healthcare,NMC Healthcare is the largest private healthcare company in the UAE and ranks amongst the leading fertility service providers in the world.,,https://uae.indeed.com/rc/clk?jk=69da2dea29f924f2&fccid=d59f4719f5b1f6db&vjs=3
543,Market Insight Lead - CEMA | Strategic Market Enterprise,Dubai,Medtronic,"Together, we can change healthcare worldwide.Let’s work together to address universal healthcare needs and improve patients’ lives.A Day in the Life.",,https://uae.indeed.com/rc/clk?jk=202f10808636b652&fccid=f06a4d05bf5510ec&vjs=3
544,Pharmacist,Al-Ayn,World Energy Group,"Advising customers on the selection of medication brands, medical equipment or healthcare supplies.Working with other healthcare professionals to plan, monitor…","AED5,000 - AED6,000 a month",https://uae.indeed.com/company/World-Energy-Group/jobs/Pharmacist-0e67c7f50b995440?fccid=bf8704ff33d1e61d&vjs=3
545,General Practitioner,Ruwais,Mubadala,"Communicate using appropriate terminology for the guest, their families and other healthcare professionals.Provides expert and appropriate medical services and…",,https://uae.indeed.com/pagead/clk?mo=r&ad=-6NYlbfkN0AXjjAlOCbQxIMFcoVa-id-9VsDv4se0BFeHHAzdcsaRj6vCn3qpHJvMvMgnTPb8MCswKidIZxi9kE2StxIy0_vhALd9AyZSSEDl7c5eSQnTMH4iUQsIBl-Fk0Zc2yKodJfClrXxBzH72ruWX-nfCHFTFMVXJuCLipNRX9dkb7xR-7K5ROjrlXD5JSHnh6vHzPBBTzH3lOwziqJzP25_ul3Y6-5EEN57ZjCqveVIcnnW36-Fjo6_vN6h8my8TETFm_WZdqwRhmpleBjXRtXmqL0OWRScC1EQsDZauck-p8KYRtyroeF-2dL-AIGs5bH18m3WEVP1MNlzuskB6qysolkgNvV8m_QyYHuGfSJ0LnCBRso2MgqCSU1-TTO6evpJp9Ct9Os8qurGAhDELzH6OcCvQ1Fopb3KdGWXKsR-muZnVCPjBbzP5p7_0vRXiIEvqU=&p=12&fvj=1&vjs=3
546,Senior Software Engineer,Dubai,Talabat,"Comprehensive healthcare as well as subsidized gym membership and parking.As part of the Delivery Hero network, Talabat is the pioneer of the online food…",,https://uae.indeed.com/rc/clk?jk=3d6121adeb563e8f&fccid=8948005a95e365ae&vjs=3
547,Respiratory Therapist,Dubai,Canadian Specialist Hospital,Provides skilled respiratory care to patients in variety of healthcare settings.Respiratory therapy technicians—also known as respiratory care practitioners…,,https://uae.indeed.com/rc/clk?jk=df8353aa46840b38&fccid=b1640b6986bbc979&vjs=3
548,Nurse Supervisor I Healthcare I Dubai- UAE,Dubai,Al-Futtaim,"As a humble family business that started on the banks of the Dubai Creek in the 1930s, Al-Futtaim has expanded to a presence in 31 countries, a portfolio of…",,https://uae.indeed.com/rc/clk?jk=79fa18d16bfbd024&fccid=b5139e4031867414&vjs=3
549,Automation Engineer ll,Dubai,Talabat,"Comprehensive healthcare as well as subsidized gym membership and parking.As part of the Delivery Hero network, Talabat is the pioneer of the online food…",,https://uae.indeed.com/rc/clk?jk=a6bdc114fb95edf7&fccid=8948005a95e365ae&vjs=3
550,SharePoint Consultant (Arabic Speaking),Ras al-Khaimah,MicroVision,We are currently looking for an experienced SharePoint Consultant for a full time role.The role will be based on site in Ras Al Khaimah for First Level Support…,,https://uae.indeed.com/rc/clk?jk=7e2730af8e5ac640&fccid=1e10041bb2747ae8&vjs=3
552,Mergers and Acquisitions Executive - Consumer Products & Ret...,Dubai,EY,"This can be within Energy, Healthcare, Financial Services, Consumer Products and Retail or Technology, Media and Telecommunications sectors.",,https://uae.indeed.com/rc/clk?jk=b725b2cd61ad2863&fccid=1544766d4c2915b0&vjs=3
553,Microsoft EPM Professionals,UAE,Najma Consultancy,"As established company in Healthcare Domain Industry is looking Certified Microsoft EPM that will be based in Dubai, UAE.3 to 4 years’ experience.",,https://uae.indeed.com/rc/clk?jk=a61f9642d7b8fb73&fccid=c590ed8473be5626&vjs=3
554,Executive/Personal Assistant (Property/Real Estate Developme...,Dubai,Omni International,"For over 15 years Omni International Consultants has supplied high caliber personnel to the global Construction, Aviation, Banking, Logistics, IT, Hospitality,…",,https://uae.indeed.com/rc/clk?jk=6692cac6a443939c&fccid=eb525ce63ed76336&vjs=3
555,Specialist Pediatric Dentist,Dubai,Drs Nicolas & Asp Center,Nicolas & Asp is the Largest Private Dental Healthcare Provider in the United Arab Emirates.Provide comprehensive oral health care for children with behavioral…,,https://uae.indeed.com/company/Drs-Nicolas-&-Asp/jobs/Specialist-Pediatric-Dentist-28d8f117d6bbec54?fccid=37172cc13f70fe2e&vjs=3
556,Pre-Sales Solution Consultant,Dubai,Hitachi Vantara Corporation,"We offer industry leading benefits packages (flexible working, generous pension and private healthcare) and promote a creative and inclusive culture.",,https://uae.indeed.com/rc/clk?jk=2e3ae3ae68bdc7d1&fccid=dd616958bd9ddc12&vjs=3
557,FULL TIME MALE SITE NURSE (DOH LICENSED/ PASSER),Abu Dhabi,PRIVATE HEALTHCARE LLC,Still hiring for additional Male Site Nurses.With Active DOH RN License or DOH Passer.Currently staying in Abu Dhabi.,"AED8,000 a month",https://uae.indeed.com/company/SHAM-LLC/jobs/Male-Site-Nurse-99113b67f37aa5b5?fccid=513750e3218c53e9&vjs=3
558,Specialist Dermatologist (HAAD licensed / Passer),Abu Dhabi,Davidson Management Consultants,"Employing thousands of healthcare professionals within UAE, this private group of hospitals is a pioneer in cutting edge healthcare services in the region and…",,https://uae.indeed.com/rc/clk?jk=94a4675e4dca16c7&fccid=d3f7b35de7842821&vjs=3
559,Sales Executive,Dubai,Medseven Healthcare Group,"Minimum 1 year Experience, Driving License is a must.Social distancing guidelines in place.","AED2,500 a month",https://uae.indeed.com/company/Medseven-Healthcare-Group/jobs/Sales-Executive-2ca970b968c4dacf?fccid=8d4ffa2a7c6133b7&vjs=3
560,Neonatologist Specialist,Abu Dhabi,Davidson Management Consultants,A reputed healthcare group that has been serving the region for over 25 years through its hospitals in Abu Dhabi and Dubai has mandated Davidson Management…,,https://uae.indeed.com/rc/clk?jk=84be9dea87bf878d&fccid=d3f7b35de7842821&vjs=3
561,Registered Nurse for School,Abu Dhabi,Healthcare Group,"Provide healthcare to students and staff.Coordinate referrals to private healthcare providers.Serve as liaisons between school personnel, family, and…","AED6,000 a month",https://uae.indeed.com/company/A-Healthcare-Group/jobs/Registered-Nurse-School-9bbdbc216e6f5056?fccid=93b9b7feca76a6fe&vjs=3
562,Laser Therapist,Sharjah,Bin Haian Healthcare group,A leading medical and cosmetic facility in Sharjah is looking for a Laser Therapist Nurse with extensive experience to join their team on a full-time basis.,,https://uae.indeed.com/pagead/clk?mo=r&ad=-6NYlbfkN0CHQqMcmqEs6FadTiMBBh_COFAus-3m3dsoTsGQG7CJcKfFKtJMZvuoM3yOUth4NoqMghZQjFXJJXbIOmLe3diB6sC7RKLBYCyCWPj0WIFTL_dWznxAeCsd_EKfaWy2-R5CIf1tUM1pkVL7WlgiQ488GanMRWo-t3hdvbG273hldFA4Pk2yHzbHCh_jIwlMsvEIXIhO3G9XqiPbJ8WLNjOv0_wfLjaR47QBFrwhHG8sdvaHMeHv9WN9BXKawlfGjzFU_JENgRKhWqmKQ9xxlzF8bczaxtJhbGBrS7AXJWqjfOgpN1dmNz4no4_Wfxo9mJ_rIPbhGMh6Vs7G-juBLkXV5Poo4A4tPaeNZhW6S6h5JDjBBOwZEQx3xrSnH0MBQfQ46EP1FW2q_tDwxRQcM2oijnwY5spAjUsMHPoxx3r4HyEQj3KoLrdp8WPWA_iwAfQ=&p=14&fvj=1&vjs=3
564,Senior Consultant,Dubai,GRMC Advisory Services,"We play an increasingly vital role in the region, advising leading private and public institutions in core sectors including real estate development, retail…",,https://uae.indeed.com/rc/clk?jk=f525b41657e2c811&fccid=359f9296934ddf35&vjs=3
566,Specialist Doctors DHA DHCC - Part Time Surgery,Dubai,DRHC Hospital,"Dubai Healthcare City, High class premium Hospital.A well renowned private Hospital, Dubai.Who already practicing in Dubai or in DHCC (having patients).",,https://uae.indeed.com/company/Dr-Rami-Hamed-Center/jobs/Specialist-Doctor-Dha-Dhcc-dfc54512c63906b0?fccid=48b5a6e70371002e&vjs=3
567,Specialist Gastroenterologist (HAAD / Passer),Abu Dhabi,Davidson Management Consultants,"One of the pioneers in the healthcare sector in Abu Dhabi, this hospital in Abu Dhabi has made a name in the region for being leaders in the use of cutting edge…",,https://uae.indeed.com/rc/clk?jk=df0507a0717b6573&fccid=d3f7b35de7842821&vjs=3
569,Senior Business Development Manager (Middle East),Dubai,Norton Rose Fulbright,"And life sciences and healthcare.Senior Business Development Manager, Middle East.The Senior Business Development Manager is a senior managerial role within…",,https://uae.indeed.com/rc/clk?jk=508e4f7d46adbe1f&fccid=13ca7d8a9898b593&vjs=3
571,"Consultant Pulmonologist & Sleep Medicine - Abu Dhabi, UAE",Abu Dhabi,Medacs Healthcare,"Our client is the Middle East's leading provider of specialised long-term care, rehabilitation and home healthcare services and is the regions pioneer in…",,https://uae.indeed.com/rc/clk?jk=40b23ac8cbf3a20b&fccid=aebff11e33fbbd12&vjs=3
572,Critical care medicine/ICU Specialist in UAE,Al-Ayn,Roljobs Technology Services Pvt Ltd,"One of the leading healthcare groups in UAE looking for a passionate "" Specialist Critical Care Medicine"" in Abu Dhabi, UAE location with an attractive salary.",,https://uae.indeed.com/rc/clk?jk=370a800d30999c5f&fccid=fe7d5c0bd56c430a&vjs=3
